<?xml version="1.0" encoding="UTF-8"?>
<concesionario xmlns:xsi="http://www.w3.org/2001/XMLSchema-instance"
 xsi:noNamespaceSchemaLocation="concesionario.xsd">
<coche matricula="6732KPC">
    <marca>Seat</marca>
    <modelo>Ateca</modelo>
    <cilindrada>1.7</cilindrada>
    <combustible>Diesel</combustible>
    <precio>23.000€</precio>
    <año>2018</año>
    <color>Negro</color>
    <interesado>33358697A</interesado>
    <interesado>30515455T</interesado>
    <fecha_limite fecha="2022-02-12"/>
</coche>
<coche matricula="8280DGH">
    <marca>Volkswagen</marca>
    <modelo>Polo</modelo>
    <cilindrada>1.2</cilindrada>
    <combustible>Gasolina</combustible>
    <precio>5.000€</precio>
    <color>Rojo</color>
    <interesado>60514553T</interesado>
</coche>
<coche matricula="8765DHG">
    <marca>Renault</marca>
    <modelo>Megane</modelo>
    <caballos>120</caballos>
    <combustible>Diesel</combustible>
    <precio>7.500€</precio>
    <color>Verde</color>
</coche>
</concesionario>